,headline_descriptions,news_source
0,Futures & Commodities,cnbc
1,The News with Shepard Smith,cnbc
2,Futures & Commodities,cnbc
3,The News with Shepard Smith,cnbc
4,"S&P 500 closes at another record Friday, gains 2% on week",cnbc
5,Iran scientist killed,cnbc
6,LA Covid Restrictions,cnbc
7,Trump loses PA appeal,cnbc
8,Black Friday shopping in stores craters 52% during pandemic as e-commerce sales surge,cnbc
9,Black Friday 2020 online shopping surges 22% to record $9 billion,cnbc
10,Salesforce buying Slack would mark the first big software deal in a boom year for the cloud,cnbc
11,Congress stalled on stimulus talks and time is running out as millions face a 'benefits cliff',cnbc
12,Black Friday shopping in stores craters 52% during pandemic as e-commerce sales surge,cnbc
13,Vaccines may help travel rebound but some pandemic changes are here to stay,cnbc
14,"Black Friday 2020 online shopping surges 22% to record $9 billion, Adobe says",cnbc
15,Congress stalled on stimulus talks as millions of Americans face 'benefits cliff',cnbc
16,This is the psychological difference between spenders and savers,cnbc
17,Advice for small business owners from this successful 17-year-old CEO,cnbc
18,"Meet Ivan Boesky: '80s Wall Street titan who inspired Hollywood, went to jail",cnbc
19,Salesforce buying Slack would be first big software deal in boom year for cloud,cnbc
20,Buy stocks like Micron and Ulta as the recovery gets underway analysts say,cnbc
21,Shoppers want their holiday gifts to matter. Companies are taking notice.,cnbc
22,"Black Friday online shopping on track to hit record as shoppers skip stores, Adobe says",cnbc
23,"Oxford, WHO scientists say more data needed on AstraZeneca's Covid vaccine trials",cnbc
24,A Black Friday unlike any other: What four retail analysts are watching,cnbc
25,"Trump will campaign for Georgia GOP Senate candidates, urges supporters not to boycott runoff elections",cnbc
26,What to watch in the market in the week ahead,cnbc
27,Trump loses appeal of Pennsylvania election case,cnbc
28,Amazon's hiring spree will get its real test starting Black Friday,cnbc
29,"As large retailers make record profits, frontline workers barely see a pay bump",cnbc
30,Pilot shortage prompts rare flight cancellations at Delta over Thanksgiving break,cnbc
31,"Long lines for Covid testing not going away soon, Summit CityMD CEO says",cnbc
32,Watch live: World Health Organization holds a briefing on Covid as Europe's outbreak appears to slow,cnbc
33,Top Iranian nuclear scientist assassinated,cnbc
34,Evictions have led to hundreds of thousands of additional Covid-19 cases,cnbc
35,Black Friday may have undergone a 'fundamental change' due to the pandemic,cnbc
36,These are Wall Street's favorite 10 retail stocks into the holiday season,cnbc
37,Google's 'resiliency' training teaches employees how to perform through stress,cnbc
38,"Stocks making the biggest moves midday: Amazon, Tesla, AstraZeneca & more",cnbc
39,Meet the 31-year-old nurse who is now a member of the New York State Assembly,cnbc
40,"Black Friday looks bleak at stores, malls, as shoppers stick to couch surfing",cnbc
41,"Thanksgiving Day online sales hit record $5.1 billion, Adobe says",cnbc
42,Former Zappos CEO Tony Hsieh has died at 46,cnbc
43,Stocks on track to close out month of big gains next week as jobs data looms,cnbc
44,Los Angeles issues stay-home order as coronavirus cases surge out of control,cnbc
45,Trump loses appeal of Pennsylvania election case,cnbc
46,Wall Street analysts are long-term bullish on these recovery plays like Micron and Ulta,cnbc
47,Biden's lead increases in Wisconsin's largest county after recount demanded by Trump campaign,cnbc
48,Supreme Court takes up Trump order to remove undocumented immigrants from population count,cnbc
49,Vaccines may help travel rebound but some pandemic changes are here to stay,cnbc
50,Whole Foods CEO John Mackey: Why I regret not having kids,cnbc
51,"Iran's president accuses Israel of killing nuclear scientist, vows to respond 'at the proper time'",cnbc
52,"Oxford, WHO scientists say more data needed on AstraZeneca's Covid vaccine trials",cnbc
53,"Holiday gift-givers want their money to matter. Companies, large and small, are taking notice.",cnbc
54,A Black Friday unlike any other: What four retail analysts are watching this holiday season,cnbc
55,The UFO ETF is up 20% this month. How a Biden administration could impact the space trade,cnbc
56,"Energy is where investors send money ‘to die’ but there is one stock to like, trader says",cnbc
57,These are Wall Street's favorite 10 retail stocks into the holiday shopping season,cnbc
58,Nextdoor is on a rocky road towards a possible public offering,cnbc
59,"Amazon's $599 router system isn't cheap, but it helps fix your bad Wi-Fi",cnbc
60,"Trump to campaign for Georgia GOP Senate candidates, urges supporters not to boycott runoff elections",cnbc
61,Pilot shortage prompts rare flight cancellations at Delta over Thanksgiving break,cnbc
62,Stocks on track to close out month of big gains as jobs data looms,cnbc
63,"Stocks making the biggest moves midday: Amazon, Tesla, AstraZeneca, Carnival & more",cnbc
64,U.S. stocks edge higher as investors monitor vaccine news,cnbc
65,"Stock market live Friday: S&P & Nasdaq records, 2% gain for week, retail ETF touches record",cnbc
66,How Nissan is trying to bounce back from losses and turmoil,cnbc
67,Shopify president on retail trends: 71% of U.S. online sales made on mobile,cnbc
68,Holiday shoppers are spending more on pets in 2020,cnbc
69,Doctors say CDC should warn people the side effects from Covid vaccine won't be 'a walk in the park',cnbc
70,Biden's lead increases in Wisconsin's largest county after recount demanded by Trump campaign,cnbc
71,Congress stalled on stimulus talks and time is running out as millions face a 'benefits cliff',cnbc
72,Black Friday shopping in stores craters 52% during pandemic as e-commerce sales surge,cnbc
73,This teen's business is bringing in 6 figures—here's her advice for other small business owners,cnbc
74,Highest-ever Amex Gold Card welcome bonus is worth up to $600 in gift cards,cnbc
75,"The silent generation has an average of $12,869 in nonmortgage debt—here's how they compare",cnbc
76,Every day is Black Friday this year: Save more money while you shop with these 8 credit cards,cnbc
77,A personal loan can deliver quick cash to cover holiday costs—but a CFP suggests you do this first,cnbc
78,The best three-year CD when you want to lock in a good interest rate,cnbc
79,A financial therapist shares her psychological trick to save money this holiday season,cnbc
80,This is the average age when people finally pay off their student loans for good,cnbc
81,How much should you spend on holiday shopping? A financial planner weighs in,cnbc
82,Wall Street analysts are long-term bullish on these recovery plays like Micron and Ulta,cnbc
83,These are Wall Street's favorite 10 retail stocks into the holiday shopping season,cnbc
84,"Amazon will be big holiday season winner getting 42 cents of every $1 spent, Truist says",cnbc
85,"CFRA's Sam Stovall says the market rotation 'looks sustainable,' gives retail picks",cnbc
86,"These economic recovery plays still have more room to run, Barclays says",cnbc
87,"These stocks will be the big winners from likely record e-commerce holiday sales, Jefferies says",cnbc
88,Goldman Sachs bankers are using flying drones to help clinch billion-dollar M&A deals,cnbc
89,Here's why Peloton and Zoom could still have room to run in a post-pandemic world,cnbc
90,"Black Friday online shopping on track to hit record as holiday shoppers skip stores, Adobe says",cnbc
91,"Oxford, WHO scientists say more data needed on AstraZeneca's Covid vaccine trials",cnbc
92,Pilot shortage prompts rare flight cancellations at Delta over Thanksgiving break,cnbc
93,"Black Friday 2020 Live Update: Bargain hunters drove record online sales, hot gifts in short supply",cnbc
94,"Long lines for Covid testing not going away anytime soon, Summit CityMD CEO says",cnbc
95,"Black Friday 2020 looks bleak at stores, malls, as shoppers stick to couch surfing",cnbc
96,Coronavirus updates: AstraZeneca CEO touts a new vaccine trial in response to doubts raised in U.S.,cnbc
97,Black Friday shopping in stores craters 52% during pandemic as e-commerce sales surge,cnbc
98,Former Zappos CEO Tony Hsieh has died at 46,cnbc
99,Amazon's hiring spree of hundreds of thousands of workers gets its real test starting Black Friday,cnbc
100,Google's 'resiliency' training teaches employees how to deal with prolonged remote work,cnbc
101,"Amazon's $599 router system isn't cheap, but it helps fix your bad Wi-Fi",cnbc
102,Salesforce buying Slack would mark the first big software deal in a boom year for the cloud,cnbc
103,Amazon gives front-line workers a $300 holiday bonus,cnbc
104,"U.S. regulators open probe into 115,000 Tesla vehicles over suspension issue",cnbc
105,Google and Facebook to be scrutinized by new U.K. antitrust unit from next year,cnbc
106,Top Iranian nuclear scientist assassinated,cnbc
107,Trump loses appeal of Pennsylvania election case,cnbc
108,Trump rants about overturning the election even as administration begins transition to Biden,cnbc
109,Trump lawyer details far-fetched strategy to reverse Pennsylvania win for Biden,cnbc
110,DOJ appeals ruling that kept Trump as defendant in E. Jean Carroll rape claim case,cnbc
111,"Another Trump campaign advisor tests positive for coronavirus, as Giuliani heads to Gettysburg",cnbc
112,"Biden team meets with former U.S. media agency leaders, including some ousted by Trump appointee",cnbc
113,Op-ed: IRS tax-refund backlog adds to Americans' hardship during Covid-19 pandemic,cnbc
114,Vaccines may help travel rebound but some pandemic changes are here to stay,cnbc
115,Congress stalled on stimulus talks and time is running out as millions face a 'benefits cliff',cnbc
116,Working remotely from different states? You could face additional state taxes next year,cnbc
117,"Evictions have led to hundreds of thousands of additional coronavirus cases, research finds",cnbc
118,Here's a decade-by-decade guide to retirement planning,cnbc
119,Personal Finance 101: The complete guide to managing your money,cnbc
120,"Costco stores only accept Visa cards, and these 5 are the best for earning rewards",cnbc
121,We analyzed 111 rewards cards: Here's our No. 1 pick for best overall,cnbc
122,Psychological difference between spenders and savers (and what it says about your personality),cnbc
123,This teen's business is bringing in 6 figures—here's her advice for other small business owners,cnbc
124,"Meet Ivan Boesky, the 1980s Wall Street titan who inspired Hollywood — and ended up in jail",cnbc
125,"As large retailers bring in record profits, frontline workers barely see their pay increase",cnbc
126,VC who's backed companies like Peloton: My best advice for growing and scaling your side hustle,cnbc
127,"Meet Phara Souffrant Forrest, 31-year-old nurse who is now a member of the New York State Assembly",cnbc
128,Whole Foods CEO John Mackey: Why I regret not having kids,cnbc
129,Main Street pins hopes on Small Business Saturday sales to help stay afloat,cnbc
130,"How to turn your side hustle into a full-time, well-paid job, according to 3 people who've done it",cnbc
131,"Forget the turkey sandwich — try these creative, cost-effective Thanksgiving leftovers instead",cnbc
132,4 sites where you can volunteer time to build skills and gain valuable work experience,cnbc
133,"3 holiday activities that are low-cost and low-risk, according to health experts",cnbc
134,We increased our net worth by $1 million in 6 years and retired early: Here's our best advice,cnbc
135,"3 reasons to do your holiday shopping now, according to a supply chain expert",cnbc
136,"Leasing is up in the pandemic — but it's a 'merry-go-round' that's 'hard to get off,' expert warns",cnbc
137,"Dow breaks 30,000, and mortgages at a record low: How the news could affect your money",cnbc
138,Subscribe to CNBC PRO,cnbc
139,Do Not Sell My Personal Information,cnbc
140,A Division of NBCUniversal,cnbc
141,Market Data Terms of Use and Disclaimers,cnbc
142,"In a historic vote, the Swiss will determine if multinationals should be held liable for global abuses",fortune
143,"In an era of political polarization, ‘Trump TV’ makes perfect sense",fortune
144,"The pandemic paradox: surviving a public health crisis breeds more science skeptics, researchers find",fortune
145,"These megacities could become breeding grounds for the next pandemic, scientists say",fortune
146,Biden’s national coronavirus strategy is starting to take shape—and it’s very different than Trump’s,fortune
147,Pfizer’s COVID vaccine comes with a chilly complication. But that may change,fortune
148,"As libraries fight for access to e-books, a new copyright champion emerges",fortune
149,"Bet on these stocks for the millennial-powered COVID recovery, says Goldman’s Katie Koch",fortune
150,Why Joe Biden is still fundraising after winning the election,fortune
151,"Gift Guide: What to give those near and dear, even when we’re apart",fortune
152,"You’re not crazy—you really hunger for social contact, scientists say",fortune
153,China slaps 200% anti-dumping tariffs on Australian wine as relations continue to sour,fortune
154,Native Americans are reshaping U.S. politics 400 years after the Mayflower,fortune
155,Are Joe Biden and Janet Yellen actually good for Bitcoin?,fortune
156,It’s the age of the mega fund,fortune
157,Is this the laptop bubble?,fortune
158,Meet the new second most powerful woman in Congress,fortune
159,Europe—and Big Tech—will give Biden a headache from Day One,fortune
160,"It may be a matter of weeks, not months, before Americans can start getting COVID vaccines",fortune
161,"R.I.P. Black Friday? Pandemic, online shopping lead to thin crowds",fortune
162,"The pandemic paradox: surviving a public health crisis breeds more science skeptics, researchers find",fortune
163,"These megacities could become breeding grounds for the next pandemic, scientists say",fortune
164,Trump says he will leave office if the Electoral College votes in Biden,fortune
165,"In an era of political polarization, ‘Trump TV’ makes perfect sense",fortune
166,MeWe is a fast-growing social hub for conservatives. What you need to know,fortune
167,Why Joe Biden is still fundraising after winning the election,fortune
168,Secluded and deluded: Trump’s post-election actions show a mad-monarch mindset,fortune
169,Gift Guide: How to turn your outdoor space into a year-round living room,fortune
170,The best wines for Thanksgiving,fortune
171,Home-improvement gifts,fortune
172,Gift Guide: Extremely 2020 holiday ornaments,fortune
173,How Jane Fraser broke banking’s highest glass ceiling,fortune
174,How Fortune ranks business’s Most Powerful Women in the COVID era,fortune
175,This ace engineer powered Amazon through the COVID crisis,fortune
176,Keurig is a machine: How the beverage giant is leveraging A.I. to fuel growth,fortune
177,Telling men’s stories through their cars,fortune
178,U.S. speeding toward COVID-19 stimulus cliff as relief programs approach Dec. 31 expiration,fortune
179,How the dark web became a haven for unemployment insurance fraud,fortune
180,$1 trillion in stimulus at stake: The shape of a deal hinges on the Georgia Senate runoffs,fortune
181,Stimulus update: McConnell and Schumer discuss averting a shutdown and economic aid,fortune
182,10 stocks to buy now: These names should perform well no matter who wins the White House,fortune
183,This year’s ‘October surprise’ could impact your portfolio for years to come,fortune
184,The biggest economic threat facing the next administration: A weak dollar,fortune
185,"Q&A: Former Commerce Secretary Penny Pritzker talks America’s R&D problem, taxes, and the country’s economic outlook",fortune
186,"ESG investing is bigger than ever. Here’s how you can save the world, and your portfolio",fortune
187,Exclusive: Apple hires Intel’s Barbara Whye as its new head of diversity,fortune
188,What businesses slammed by the pandemic can learn from America’s champion car salesman,fortune
189,"When Kamala Harris assumes the role of VP, there will be zero Black women in the Senate",fortune
190,Biden unveils COVID-19 task force that is 38% female and 69% underrepresented minority,fortune
191,The email security market is littered with false claims. How to fix it,fortune
192,Why it would be a huge mistake to allow Big Tech firms to acquire banks,fortune
193,There’s a third way to minimize COVID exposure besides masks and distancing. Let’s start using it,fortune
194,Better conversations: The 7 essential elements of meaningful communication,fortune
195,COVID vaccines won’t come fast enough to save struggling businesses. But plasma might,fortune
196,Prohibitionist dogma has no place in government alcohol guidance,fortune
197,Allbirds is stepping up for the planet—by treading lightly on it,fortune
198,America’s Black brain drain: Why African-American professionals are moving abroad—and staying there,fortune
199,How reborn pharma giant AstraZeneca is taking the lead against COVID-19,fortune
200,Is oil giant BP finally ready to ‘think outside the barrel’?,fortune
201,Will India’s Jio be the next tech giant?,fortune
202,Facebook’s A.I. is getting better at finding malicious content—but it won’t solve the company’s problems,fortune
203,EV startup Arrival goes public at $5.4 billion valuation in SPAC deal,fortune
204,U.S. sanctions force Huawei to sell its budget smartphone brand,fortune
205,Airbnb’s IPO filing reveals huge COVID impact,fortune
206,"Japan’s jailing of Carlos Ghosn was overly ‘harsh’ and compromises their case, U.N. rights lawyers say",fortune
207,Autonomous delivery startup Gatik raises $25 million in Series A funding,fortune
208,Who’s liable when a self-driving car collides with another vehicle?,fortune
209,A sneak peek at the women speaking at Fortune’s Brainstorm Tech 2020,fortune
210,When ‘going the extra mile’ becomes a problem,fortune
211,Women in finance have to ask for promotions. Men don’t,fortune
212,Hard conversations need great design,fortune
213,How design keeps companies focused on people as the pandemic pushes businesses online,fortune
214,Will pandemic-era travel bubbles be filled with ‘Airspace’?,fortune
215,Oil slips from its eight-month high as OPEC+ tensions rise,fortune
216,"The world’s largest wind farm is truly enormous, and it’s one step closer to reality",fortune
217,Why Beyond Meat’s CEO chose to fight climate change by going into business,fortune
218,What Blizzard learned by making a hit video game from home,fortune
219,Nvidia plans to bring Fortnite back to the iPhone despite Apple ban,fortune
220,‘Wonder Woman’ will debut on same day in theaters and on HBO Max,fortune
221,"In a historic vote, the Swiss will determine if multinationals should be held liable for global abuses",fortune
222,The Supreme Court will decide: Can Big Chocolate be blamed for child slavery?,fortune
223,"She’s pushing a green, digital, diverse future. And this CEO doesn’t care who the president is",fortune
224,Georgia Senate runoff: Republican Perdue boosted his wealth with well-timed stock trades,fortune
225,When second stimulus checks could arrive if Biden strikes a deal,fortune
226,Who will Biden name as SEC chair? Here are insiders’ best guesses,fortune
227,AstraZeneca eyes another global trial for its COVID vaccine following dosage blip,fortune
228,Italy allows first quarantine-free flights from U.S. to Europe since the beginning of the pandemic,fortune
229,Delta and Alitalia are bringing back quarantine-free flights between the U.S. and Europe,fortune
230,Thousands of Amazon workers will walk off the job today to fight for fair pay and COVID protections,fortune
231,China slaps 200% anti-dumping tariffs on Australian wine as relations continue to sour,fortune
232,"Christmas aside, Germany prepares for a long, locked-down winter",fortune
233,1 in 3 Americans are planning a holiday trip,fortune
234,"Meet the sisters self-funding a sustainable footwear brand, creating shoes that ‘celebrate every woman’s step’",fortune
235,Black winemakers are climbing up the vine,fortune
236,"Biden has ambitious executive order options, if he’s bold enough to sign them",fortune
237,Nancy Pelosi isn’t the only woman in House leadership anymore. Meet incoming Assistant Speaker Katherine Clark,fortune
238,Formal transition to Biden administration authorized to begin as GSA issues statement,fortune
239,"Tony Hsieh, retired Zappos CEO, dies at 46",fortune
240,Facebook’s AI is mistakenly banning some small business’ ads,fortune
241,Amazon says it will offer warehouse staff a one time bonus amid union drive,fortune
242,"Everything to know about T-Mobile, Verizon, and AT&T’s 5G plans",fortune
243,"Left for dead, twice, RadioShack gets another shot online",fortune
244,"Bitcoin bombs lower, taking other digital coins with it",fortune
245,Boeing shares pop as European regulators prepare for the ungrounding of the 737 Max,fortune
246,Airlines face $157 billion in losses as COVID is expected to wipe out even more flights in the year ahead,fortune
247,Hong Kong’s travel bubble bursts as city enters fourth wave of COVID-19,fortune
248,World’s Greatest Leaders,fortune
249,World’s Most Admired Companies,fortune
250,Frequently Asked Questions,fortune
251,Customer Service Portal,fortune
252,FORTUNE Knowledge Group,fortune
253,FORTUNE Branded Content,fortune
254,Behavioral Advertising Notice,fortune
255,CA Notice at Collection and Privacy Notice,fortune
256,Do Not Sell My Personal Information,fortune
257,http://www.djindexes.com/mdsidx/html/tandc/indexestandcs.html,fortune
258,Interactive Data Managed Solutions,fortune
259,Best Black Friday Deals,businessinsider
260,Live Black Friday Deals,businessinsider
261,Apple Black Friday Deals,businessinsider
262,"Search iconA magnifying glass. It indicates, ""Click to perform a search"".",businessinsider
263,"Insider logoThe word ""Insider"".",businessinsider
264,"Business Insider logoThe words ""Business Insider"".",businessinsider
265,"Business Insider logoThe words ""Business Insider"".",businessinsider
266,BusinessThe word Business,businessinsider
267,"Search iconA magnifying glass. It indicates, ""Click to perform a search"".",businessinsider
268,"Insider logoThe word ""Insider"".",businessinsider
269,"Business Insider logoThe words ""Business Insider"".",businessinsider
270,"Business Insider logoThe words ""Business Insider"".",businessinsider
271,"Search iconA magnifying glass. It indicates, ""Click to perform a search"".",businessinsider
272,"Insider logoThe word ""Insider"".",businessinsider
273,BusinessThe word Business,businessinsider
274,Transforming Business,businessinsider
275,Facebook IconThe letter F.,businessinsider
276,"Twitter iconA stylized bird with an open mouth, tweeting.",businessinsider
277,"LinkedIn iconThe word ""in"".",businessinsider
278,YouTube iconA play button in the shape of a television screen.,businessinsider
279,Instagram iconA stylized camera.,businessinsider
280,Reprints & Permissions,businessinsider
281,"Business Insider logoThe words ""Business Insider"".",businessinsider
282,Best Black Friday Deals,businessinsider
283,Live Black Friday Deals,businessinsider
284,Apple Black Friday Deals,businessinsider
285,All Cyber Monday Deals                     NextClick here to go to next slide.,businessinsider
286,Best Black Friday Deals,businessinsider
287,Live Black Friday Deals,businessinsider
288,Apple Black Friday Deals,businessinsider
289,The fire that led to the death of former Zappos CEO Tony Hsieh occurred over a week before he succumbed to injuries,businessinsider
290,Cyber Monday: get free access to Yale's Science of Well-being course,businessinsider
291,"Ex-CISA director, Chris Krebs, dismisses Trump's voter fraud claims",businessinsider
292,Trump spent $3 million for a vote recount in Wisconsin,businessinsider
293,Amazon workers stage Black Friday protests over pay and conditions,businessinsider
294,"Biden will leave decision about who gets the coronavirus vaccine first up to public health experts and scientists, his COVID-19 advisor says",businessinsider
295,The Supreme Court refused to get involved in the case of a Louisiana pastor who ignored the governor's order banning large gatherings,businessinsider
296,"The 250+ best Cyber Monday store sales of 2020, from big-box retailers to our favorite startups",businessinsider
297,"The 25 best Black Friday deals still available on Saturday include $100 off a Sonos soundbar, $45 off Kindle Paperwhite, and more",businessinsider
298,Election 2020 IconStars and the year 2020 icon that represents the 2020 election,businessinsider
299,"Facing the first loss of their voting lives, young Republicans are surprisingly hopeful, but want the GOP to work for Gen Z",businessinsider
300,"The rise and fall of J. Walter Thompson, the world's oldest advertising agency",businessinsider
301,"Fresh air can combat COVID-19. For Italy's most polluted town, in the shadow of a steel mill, opening the windows is not an option.",businessinsider
302,"Small businesses are seeing the biggest shift in how we shop since the Great Depression. Here's how entrepreneurs can reach the morally minded, Instagram-oriented customer.",businessinsider
303,Is Silicon Valley finally dead?,businessinsider
304,"Cooking classes, dozens of singers, and a 29-hour extravaganza: Here's how Wall Street and Big Law plan to throw their lavish winter holiday parties online",businessinsider
305,"Today's best mortgage and refinance rates: Saturday, November 28, 2020",businessinsider
306,Tesla is in just the right position to compete in the world's biggest electric-car markets — and justify its insane market cap,businessinsider
