,headline_descriptions,news_source
307,Start your new project today with the best Home Depot coupon codes.,businessinsider
308,Work smarter not harder with Staples' variety of discounted offerings on all things office and classroom.,businessinsider
309,Put your best foot forward with our best DSW offers.,businessinsider
310,"The most comfortable beds, the most reassuring prices with Casper coupons.",businessinsider
311,Tony Hsieh was both a visionary and a genius. He was also fundamentally someone who wanted to make people happy.,businessinsider
312,"Cyber Monday is a great time to shop for a new mattress — these are the best mattress deals from Purple, Helix, Casper, and more",businessinsider
313,Amazon is expanding its logistics empire like never before to prepare for this holiday season — and it still may not be enough,businessinsider
314,"Lululemon's Cyber Monday sale includes big discounts on popular items like Wunder Under leggings, running shorts, sports bras, and more",businessinsider
315,The Future of Retail: Online Checkout,businessinsider
316,"Cyber Monday Deals 2020: Here are the best deals on Apple Watch, smart TVs, laptops, Roku, and more, plus answers to FAQs",businessinsider
317,"Cyber Monday deals are already happening at Macy's, including big discounts on Instant Pots, Shark vacuums, Urban Decay palettes, and Fitbits",businessinsider
318,THE GLOBAL SMB NEOBANKS REPORT: How 17 upstarts are tailoring solutions to tap the $850 billion annual opportunity in addressing the unmet needs of SMBs,businessinsider
319,"Cole Haan's Cyber Monday sale has discounts up to 70% — we found sneakers, pumps, oxfords, and more for under $50",businessinsider
320,GOP congressman calls party's refusal to acknowledge Biden's win a 'massive grift' and says Trump 'forgot he was serving people and not himself',businessinsider
321,"REVIEW: The $144,000 Taycan 4S is Porsche's first EV that pairs cosmic speed with eerie electric silence",businessinsider
322,'They don't care whether it looks like an alien invasion':  A Canadian inventor says many people prefer his $379 BioVyzr COVID-19 helmet to masks,businessinsider
323,"REVEALED: How much Tesla, Rivian, and Nikola pay their employees, from engineers to managers",businessinsider
324,"I thought I was well-prepared for homeownership, but I never saw 2 costly surprises coming my way",businessinsider
325,"From bootcamps to college degrees, here is how to get into the tech industry",businessinsider
326,"Once friends, now estranged: Inside the ill-fated relationship between Vista CEO Robert Smith and Nate Paul, the Austin investor embroiled in a political scandal",businessinsider
327,"Apple Cyber Monday 2020 deals are available right now, including the Apple Watch, AirPods, and more — here are the best discounts",businessinsider
328,"THE DIGITAL HEALTH ECOSYSTEM: The most important players, tech, and trends propelling the digital transformation of the $3.7 trillion healthcare industry",businessinsider
329,"Walmart has tons of deals for Cyber Monday 2020 — here are the best ones available now, plus everything you need to know",businessinsider
330,Election 2020 IconStars and the year 2020 icon that represents the 2020 election,businessinsider
331,Rep. Jim Clyburn says that Biden should select more Black appointees for high-ranking administration posts,businessinsider
332,Amazon's Leap Into Healthcare,businessinsider
333,"Cyber Monday Apple AirPods deals slash nearly $60 off AirPods Pro, and $50 off AirPods with Wired Charging or with Wireless Charging",businessinsider
334,"Apple Watch Cyber Monday deals are available now, and the Apple Watch Series 6 is at an all-time low of $330",businessinsider
335,"Kohl's has several early Cyber Monday deals happening now, plus you can still earn $10 in Kohl's Cash for every $50 you spend",businessinsider
336,THE BANKING-AS-A-SERVICE REPORT: The major players and best practices behind the business model that's reshaping incumbents' DNA,businessinsider
337,"Cyber Monday TV deals from top brands, like Samsung, LG, TCL, Sony, and more are going strong right now",businessinsider
338,"A husband and wife in the Hudson Valley convert vintage Airstreams into tiny homes that they sell for $100,000 and name after famous women",businessinsider
339,"The best Apple Watch Black Friday deals include discounts on the Series 6, SE, and Series 3",businessinsider
340,The best Black Friday deals on online courses include a 2-for-1 discount on Masterclass and up to 90% off Udemy classes,businessinsider
341,"Meet 5 companies snapping up bankrupt 'zombie brands' like Radio Shack, Brooks Brothers, and Pier 1",businessinsider
342,How to get a PlayStation 5: Resellers give their 6 best tips to help you buy the hard-to-find console,businessinsider
343,"Hong Kong's leader is being paid in cash due to US sanctions. Carrie Lam earns $56,000 a month and says money is now piling up at her house.",businessinsider
344,"Get the latest news, data, highlights, and analysis from the Business Insider Intelligence research team - FREE",businessinsider
345,Election 2020 IconStars and the year 2020 icon that represents the 2020 election,businessinsider
346,Cindy McCain is under consideration to become US Ambassador to the United Kingdom: report,businessinsider
347,"Target's Cyber Monday sale will include deals on home essentials, kitchen appliances, and electronics — here's everything you need to know, plus early deals happening now",businessinsider
348,"The Best Black Friday 2020 Deals Right Now: Amazon, Walmart, Best Buy, Target, & More",businessinsider
349,"Kim Jong-Un is reportedly displaying 'excessive anger' over the economic impact of the coronavirus pandemic, ordering the execution of two people",businessinsider
350,Start your new project today with the best Home Depot coupon codes.,businessinsider
351,Work smarter not harder with Staples' variety of discounted offerings on all things office and classroom.,businessinsider
352,Put your best foot forward with our best DSW offers.,businessinsider
353,"The most comfortable beds, the most reassuring prices with Casper coupons.",businessinsider
354,Reprints & Permissions,businessinsider
